,phrase,contaminant,date,city,county,main city,main county,title,page_url
133," ""We need to do everything we can to ensure our children aren’t getting sick from drinking water, and that means public reporting of this new data on lead in schools as well as investment in a safe drinking water fund that can address operation and maintenance needs in schools and communities.",lead,"January 18, 2017","['tulare', 'orosi']",['tulare'],tulare,tulare,Free Water Testing for Lead Available to California Schools - Community Water Center,https://www.communitywatercenter.org/free_lead_testing
134, Here is a fact sheet in English and Spanish about the new lead testing initiative.,lead,"January 18, 2017","['tulare', 'orosi']",['tulare'],tulare,tulare,Free Water Testing for Lead Available to California Schools - Community Water Center,https://www.communitywatercenter.org/free_lead_testing
135,"”Water justice advocates have been working for years to secure a sustainable source of funding to address water affordability challenges and meet both capital cost and operation and maintenance (O&M) needs in low-income communities impacted by nitrates, arsenic, pesticides, and other contaminants.",arsenic,"January 12, 2017","['tulare', 'alpaugh']",['tulare'],tulare,tulare,News Release: Safe and Affordable Drinking Water Needs Recognized in California Budget - Community Water Center,https://www.communitywatercenter.org/news_release_water_california_budget_2017
136,"”Water justice advocates have been working for years to secure a sustainable source of funding to address water affordability challenges and meet both capital cost and operation and maintenance (O&M) needs in low-income communities impacted by nitrates, arsenic, pesticides, and other contaminants.",nitrate,"January 12, 2017","['tulare', 'alpaugh']",['tulare'],tulare,tulare,News Release: Safe and Affordable Drinking Water Needs Recognized in California Budget - Community Water Center,https://www.communitywatercenter.org/news_release_water_california_budget_2017
137,"”Water justice advocates have been working for years to secure a sustainable source of funding to address water affordability challenges and meet both capital cost and operation and maintenance (O&M) needs in low-income communities impacted by nitrates, arsenic, pesticides, and other contaminants.",nitrates,"January 12, 2017","['tulare', 'alpaugh']",['tulare'],tulare,tulare,News Release: Safe and Affordable Drinking Water Needs Recognized in California Budget - Community Water Center,https://www.communitywatercenter.org/news_release_water_california_budget_2017
138, As President-elect Trump moves to dismantle the EPA and roll back the Clean Water Act it is incumbent upon California’s elected leaders to act to expand access to safe drinking water for all our communities.,lead,"January 12, 2017","['tulare', 'alpaugh']",['tulare'],tulare,tulare,News Release: Safe and Affordable Drinking Water Needs Recognized in California Budget - Community Water Center,https://www.communitywatercenter.org/news_release_water_california_budget_2017
139," No matter what the state says about our water levels being within the threshold of what’s considered safe for arsenic, I know that no level of arsenic is safe.",arsenic,"December 30, 2016","['jackson', 'porterville']",[],jackson,,'They’re Not Going to Be Able to Ignore This Entire City Standing Together' - Community Water Center,https://www.communitywatercenter.org/city_standing_together
140," Water polluted with nitrates, arsenic, and pesticides looks, smells, and tastes safe, but drinking contaminated water can cause nausea, miscarriages, and cancer.",arsenic,"December 30, 2016","['jackson', 'porterville']",[],jackson,,'They’re Not Going to Be Able to Ignore This Entire City Standing Together' - Community Water Center,https://www.communitywatercenter.org/city_standing_together
141," Water polluted with nitrates, arsenic, and pesticides looks, smells, and tastes safe, but drinking contaminated water can cause nausea, miscarriages, and cancer.",nitrate,"December 30, 2016","['jackson', 'porterville']",[],jackson,,'They’re Not Going to Be Able to Ignore This Entire City Standing Together' - Community Water Center,https://www.communitywatercenter.org/city_standing_together
142," Water polluted with nitrates, arsenic, and pesticides looks, smells, and tastes safe, but drinking contaminated water can cause nausea, miscarriages, and cancer.",nitrates,"December 30, 2016","['jackson', 'porterville']",[],jackson,,'They’re Not Going to Be Able to Ignore This Entire City Standing Together' - Community Water Center,https://www.communitywatercenter.org/city_standing_together
143," (Stephen Yang/Reuters)From toxic levels of lead coursing through pipes in Flint, Michigan, to the ongoing fight for clean water raging in California’s Central Valley—where chemical waste sites have contaminated local water sources for decades—to the start of a massive protest over an oil pipeline that could poison groundwater in the Standing Rock Sioux reservation in North Dakota, water was a hot-button issue throughout 2016.",lead,"December 30, 2016","['jackson', 'porterville']",[],jackson,,'They’re Not Going to Be Able to Ignore This Entire City Standing Together' - Community Water Center,https://www.communitywatercenter.org/city_standing_together
144,"”Wieckowski’s bill followed a 2015 report by the State Water Resources Control Board that found small water systems more often have violations for contaminants such as arsenic, nitrate and uranium.",arsenic,"December 14, 2016","['fresno', 'tulare']",['tulare'],fresno,tulare,Toxic water plagues rural California - Community Water Center,https://www.communitywatercenter.org/toxic_water
145," After multiple high levels of arsenic, the Pratt Mutual Water Company, which served about 1,500 mostly poor and Latino residents in the Matheny Tract community of Tulare County, was mandated to join the city of Tulare system.",arsenic,"December 14, 2016","['fresno', 'tulare']",['tulare'],fresno,tulare,Toxic water plagues rural California - Community Water Center,https://www.communitywatercenter.org/toxic_water
146,"”Wieckowski’s bill followed a 2015 report by the State Water Resources Control Board that found small water systems more often have violations for contaminants such as arsenic, nitrate and uranium.",nitrate,"December 14, 2016","['fresno', 'tulare']",['tulare'],fresno,tulare,Toxic water plagues rural California - Community Water Center,https://www.communitywatercenter.org/toxic_water
147," The school’s own system was giving students and staff water with high levels of nitrate, a naturally occurring chemical that can be elevated because of agricultural runoff.",nitrate,"December 14, 2016","['fresno', 'tulare']",['tulare'],fresno,tulare,Toxic water plagues rural California - Community Water Center,https://www.communitywatercenter.org/toxic_water
148,Sepulveda said he knew nitrates were a problem but not lead.,nitrate,"December 14, 2016","['fresno', 'tulare']",['tulare'],fresno,tulare,Toxic water plagues rural California - Community Water Center,https://www.communitywatercenter.org/toxic_water
149,Sepulveda said he knew nitrates were a problem but not lead.,nitrates,"December 14, 2016","['fresno', 'tulare']",['tulare'],fresno,tulare,Toxic water plagues rural California - Community Water Center,https://www.communitywatercenter.org/toxic_water
150,"com/story/news/local/2016/12/13/toxic-water-plagues-rural-california/95404472/Californians relying on small water utilities to bring drinking water into their homes, or who work or go to school in places providing their own water, are far more likely to be exposed to lead, according to a new analysis of Environmental Protection Agency data by The Desert Sun and USA TODAY.",lead,"December 14, 2016","['fresno', 'tulare']",['tulare'],fresno,tulare,Toxic water plagues rural California - Community Water Center,https://www.communitywatercenter.org/toxic_water
151,"Small public water systems across the state made up the vast majority of systems found to have high levels of lead in their drinking water or testing violations since 2010, the analysis found.",lead,"December 14, 2016","['fresno', 'tulare']",['tulare'],fresno,tulare,Toxic water plagues rural California - Community Water Center,https://www.communitywatercenter.org/toxic_water
152,"The results are evidence that while most water utilities across the state have clean records when it comes to lead, smaller agencies with limited resources more often struggle more often to comply with safety protocols.",lead,"December 14, 2016","['fresno', 'tulare']",['tulare'],fresno,tulare,Toxic water plagues rural California - Community Water Center,https://www.communitywatercenter.org/toxic_water
153,The Bodega Water Company has seen excessive levels of lead in drinking water five times since 2010.,lead,"December 14, 2016","['fresno', 'tulare']",['tulare'],fresno,tulare,Toxic water plagues rural California - Community Water Center,https://www.communitywatercenter.org/toxic_water
154," According to Williams, the problem is not the water or wells that supply it but is old lead plumbing fixtures inside the community’s historic homes.",lead,"December 14, 2016","['fresno', 'tulare']",['tulare'],fresno,tulare,Toxic water plagues rural California - Community Water Center,https://www.communitywatercenter.org/toxic_water
155,"”Tests for lead and copper are typically required every three years nationally, but a high lead reading would initiate follow-up tests every six months.",lead,"December 14, 2016","['fresno', 'tulare']",['tulare'],fresno,tulare,Toxic water plagues rural California - Community Water Center,https://www.communitywatercenter.org/toxic_water
156, The Bodega Water Company last saw a high lead reading in 2012.,lead,"December 14, 2016","['fresno', 'tulare']",['tulare'],fresno,tulare,Toxic water plagues rural California - Community Water Center,https://www.communitywatercenter.org/toxic_water
157, Experts say no amount of lead is considered safe.,lead,"December 14, 2016","['fresno', 'tulare']",['tulare'],fresno,tulare,Toxic water plagues rural California - Community Water Center,https://www.communitywatercenter.org/toxic_water
158,"While experts say lead has been less of a problem in California than other states, concerns about small water systems not meeting standards for other contaminants have prompted state officials to try and limit the number of new small systems and combine existing systems when possible.",lead,"December 14, 2016","['fresno', 'tulare']",['tulare'],fresno,tulare,Toxic water plagues rural California - Community Water Center,https://www.communitywatercenter.org/toxic_water
159,"The Desert Sun analysis of EPA data found that since 2010, 541 public water systems in the state either had drinking water tests with high lead levels or violations for improper testing.",lead,"December 14, 2016","['fresno', 'tulare']",['tulare'],fresno,tulare,Toxic water plagues rural California - Community Water Center,https://www.communitywatercenter.org/toxic_water
160," As a new USA TODAY investigation found, about 4 million Americans get water from small operators who skipped required tests or did not conduct tests property, and about 100,000 people get their drinking water from utilities that discovered high lead but failed to treat the water to remove it.",lead,"December 14, 2016","['fresno', 'tulare']",['tulare'],fresno,tulare,Toxic water plagues rural California - Community Water Center,https://www.communitywatercenter.org/toxic_water
161," Larger systems, for example, must perform water quality checks that only become required of smaller systems once lead is detected.",lead,"December 14, 2016","['fresno', 'tulare']",['tulare'],fresno,tulare,Toxic water plagues rural California - Community Water Center,https://www.communitywatercenter.org/toxic_water
162,"Students at Orange Center School, a K-8 school outside of Fresno, have relied on water coolers instead of the school’s built-in drinking fountains for more than two years because of high lead readings going back to 2010.",lead,"December 14, 2016","['fresno', 'tulare']",['tulare'],fresno,tulare,Toxic water plagues rural California - Community Water Center,https://www.communitywatercenter.org/toxic_water
163,"Since 2010, the elementary school has exceeded acceptable levels of lead seven times, the most of any water system in the state.",lead,"December 14, 2016","['fresno', 'tulare']",['tulare'],fresno,tulare,Toxic water plagues rural California - Community Water Center,https://www.communitywatercenter.org/toxic_water
164," Because the pipes aren’t being used, it’s possible for lead to accumulate over time.",lead,"December 14, 2016","['fresno', 'tulare']",['tulare'],fresno,tulare,Toxic water plagues rural California - Community Water Center,https://www.communitywatercenter.org/toxic_water
165,Sepulveda said he knew nitrates were a problem but not lead.,lead,"December 14, 2016","['fresno', 'tulare']",['tulare'],fresno,tulare,Toxic water plagues rural California - Community Water Center,https://www.communitywatercenter.org/toxic_water
166," Williams, the Bodega Water Company president, said he can treat the well water to make it less corrosive to lead pipes, but as far as consolidation, he’s in the same situation as other small, remote systems.",lead,"December 14, 2016","['fresno', 'tulare']",['tulare'],fresno,tulare,Toxic water plagues rural California - Community Water Center,https://www.communitywatercenter.org/toxic_water
167,"”Wieckowski’s bill followed a 2015 report by the State Water Resources Control Board that found small water systems more often have violations for contaminants such as arsenic, nitrate and uranium.",uranium,"December 14, 2016","['fresno', 'tulare']",['tulare'],fresno,tulare,Toxic water plagues rural California - Community Water Center,https://www.communitywatercenter.org/toxic_water
168,"In addition to voter engagement, we’re also working to develop and support leaders who are more representative of and accountable to our communities.",lead,"November 10, 2016",[],[],,,United for Water Justice - Community Water Center,https://www.communitywatercenter.org/united_for_water_justice
169," If you are or someone you know is a local water leader, please let us know.",lead,"November 10, 2016",[],[],,,United for Water Justice - Community Water Center,https://www.communitywatercenter.org/united_for_water_justice
170,Ramirez talked to voters about the nonprofit’s effort to persuade county leaders to enact an emergency ordinance limiting groundwater extraction because of the drought.,lead,"October 30, 2016","['fresno', 'tulare']",['tulare'],fresno,tulare,"Being Undocumented Means They Can't Vote, But They Registered Those Who Can - Community Water Center",https://www.communitywatercenter.org/undocumented_registered_vote
171," The other one is polluted with nitrates, colorless odorless contaminants linked to fertilizer use.",nitrate,"October 24, 2016","['poplar', 'tulare']",['tulare'],poplar,tulare,Why Is an 11-Year-Old Registering His Neighbors to Vote? It’s the Water - Community Water Center,https://www.communitywatercenter.org/11yearold_registering_voters
172,"Boiling nitrates, by the way, doesn’t get rid of them.",nitrate,"October 24, 2016","['poplar', 'tulare']",['tulare'],poplar,tulare,Why Is an 11-Year-Old Registering His Neighbors to Vote? It’s the Water - Community Water Center,https://www.communitywatercenter.org/11yearold_registering_voters
173, One of the town’s wells has high level of nitrates.,nitrate,"October 24, 2016","['poplar', 'tulare']",['tulare'],poplar,tulare,Why Is an 11-Year-Old Registering His Neighbors to Vote? It’s the Water - Community Water Center,https://www.communitywatercenter.org/11yearold_registering_voters
174," The other one is polluted with nitrates, colorless odorless contaminants linked to fertilizer use.",nitrates,"October 24, 2016","['poplar', 'tulare']",['tulare'],poplar,tulare,Why Is an 11-Year-Old Registering His Neighbors to Vote? It’s the Water - Community Water Center,https://www.communitywatercenter.org/11yearold_registering_voters
175,"Boiling nitrates, by the way, doesn’t get rid of them.",nitrates,"October 24, 2016","['poplar', 'tulare']",['tulare'],poplar,tulare,Why Is an 11-Year-Old Registering His Neighbors to Vote? It’s the Water - Community Water Center,https://www.communitywatercenter.org/11yearold_registering_voters
176, One of the town’s wells has high level of nitrates.,nitrates,"October 24, 2016","['poplar', 'tulare']",['tulare'],poplar,tulare,Why Is an 11-Year-Old Registering His Neighbors to Vote? It’s the Water - Community Water Center,https://www.communitywatercenter.org/11yearold_registering_voters
177,"html A state water agency has told some farmers in Tulare County that their operations caused nitrates to get into drinking water, and that the contamination must be replaced with a clean source.",nitrate,"October 22, 2016","['davis', 'poplar', 'salinas', 'fresno', 'tulare']",['tulare'],tulare,tulare,State Letter to Farmers Demands Water to Fix Nitrate Problem - Community Water Center,https://www.communitywatercenter.org/state_letter_to_farmers
178," Nitrates are a byproduct of nitrogen in fertilizers used in agriculture for decades, although some farmers point out nitrates also occur naturally.",nitrate,"October 22, 2016","['davis', 'poplar', 'salinas', 'fresno', 'tulare']",['tulare'],tulare,tulare,State Letter to Farmers Demands Water to Fix Nitrate Problem - Community Water Center,https://www.communitywatercenter.org/state_letter_to_farmers
179,LoBue said the answer to the nitrate problem in drinking water should not involve the enforcement division of the state board.,nitrate,"October 22, 2016","['davis', 'poplar', 'salinas', 'fresno', 'tulare']",['tulare'],tulare,tulare,State Letter to Farmers Demands Water to Fix Nitrate Problem - Community Water Center,https://www.communitywatercenter.org/state_letter_to_farmers
180," “It’s the only mechanism we have” to help the small water systems serving poor communities get nitrate-free drinking water, she said.",nitrate,"October 22, 2016","['davis', 'poplar', 'salinas', 'fresno', 'tulare']",['tulare'],tulare,tulare,State Letter to Farmers Demands Water to Fix Nitrate Problem - Community Water Center,https://www.communitywatercenter.org/state_letter_to_farmers
181,"6 million people rely on groundwater polluted by nitrates, including many of the poorest communities in the state.",nitrate,"October 22, 2016","['davis', 'poplar', 'salinas', 'fresno', 'tulare']",['tulare'],tulare,tulare,State Letter to Farmers Demands Water to Fix Nitrate Problem - Community Water Center,https://www.communitywatercenter.org/state_letter_to_farmers
182,"”Problems with the waterThe problem of nitrates in drinking water has been a ticking time bomb in farm country for years, especially since 2010, when the Legislature ordered the State Water Resources Control Board to prepare a report about nitrates in drinking water.",nitrate,"October 22, 2016","['davis', 'poplar', 'salinas', 'fresno', 'tulare']",['tulare'],tulare,tulare,State Letter to Farmers Demands Water to Fix Nitrate Problem - Community Water Center,https://www.communitywatercenter.org/state_letter_to_farmers
183,"Two years later, the Harter report from UC Davis came out, stating that 96 percent of human-generated nitrates entering groundwater in the Tulare Lake Basin and Salinas Valley came from cropland.",nitrate,"October 22, 2016","['davis', 'poplar', 'salinas', 'fresno', 'tulare']",['tulare'],tulare,tulare,State Letter to Farmers Demands Water to Fix Nitrate Problem - Community Water Center,https://www.communitywatercenter.org/state_letter_to_farmers
184,"Tulare County Supervisor Allen Ishida, a citrus farmer from Lindsay, said the report failed to determine exactly where nitrates came from.",nitrate,"October 22, 2016","['davis', 'poplar', 'salinas', 'fresno', 'tulare']",['tulare'],tulare,tulare,State Letter to Farmers Demands Water to Fix Nitrate Problem - Community Water Center,https://www.communitywatercenter.org/state_letter_to_farmers
185,"“Harter was not asked to source the nitrates or age the water,” he said, pointing out that some water has been in the ground for eons and that nitrates can (come) from sources besides farms.",nitrate,"October 22, 2016","['davis', 'poplar', 'salinas', 'fresno', 'tulare']",['tulare'],tulare,tulare,State Letter to Farmers Demands Water to Fix Nitrate Problem - Community Water Center,https://www.communitywatercenter.org/state_letter_to_farmers
186,"Cristobal Chavez, 58, tested his well at his home near Poplar four months ago and found it was too high in nitrates to be safe to drink.",nitrate,"October 22, 2016","['davis', 'poplar', 'salinas', 'fresno', 'tulare']",['tulare'],tulare,tulare,State Letter to Farmers Demands Water to Fix Nitrate Problem - Community Water Center,https://www.communitywatercenter.org/state_letter_to_farmers
187,"html A state water agency has told some farmers in Tulare County that their operations caused nitrates to get into drinking water, and that the contamination must be replaced with a clean source.",nitrates,"October 22, 2016","['davis', 'poplar', 'salinas', 'fresno', 'tulare']",['tulare'],tulare,tulare,State Letter to Farmers Demands Water to Fix Nitrate Problem - Community Water Center,https://www.communitywatercenter.org/state_letter_to_farmers
188," Nitrates are a byproduct of nitrogen in fertilizers used in agriculture for decades, although some farmers point out nitrates also occur naturally.",nitrates,"October 22, 2016","['davis', 'poplar', 'salinas', 'fresno', 'tulare']",['tulare'],tulare,tulare,State Letter to Farmers Demands Water to Fix Nitrate Problem - Community Water Center,https://www.communitywatercenter.org/state_letter_to_farmers
189,"6 million people rely on groundwater polluted by nitrates, including many of the poorest communities in the state.",nitrates,"October 22, 2016","['davis', 'poplar', 'salinas', 'fresno', 'tulare']",['tulare'],tulare,tulare,State Letter to Farmers Demands Water to Fix Nitrate Problem - Community Water Center,https://www.communitywatercenter.org/state_letter_to_farmers
190,"”Problems with the waterThe problem of nitrates in drinking water has been a ticking time bomb in farm country for years, especially since 2010, when the Legislature ordered the State Water Resources Control Board to prepare a report about nitrates in drinking water.",nitrates,"October 22, 2016","['davis', 'poplar', 'salinas', 'fresno', 'tulare']",['tulare'],tulare,tulare,State Letter to Farmers Demands Water to Fix Nitrate Problem - Community Water Center,https://www.communitywatercenter.org/state_letter_to_farmers
191,"Two years later, the Harter report from UC Davis came out, stating that 96 percent of human-generated nitrates entering groundwater in the Tulare Lake Basin and Salinas Valley came from cropland.",nitrates,"October 22, 2016","['davis', 'poplar', 'salinas', 'fresno', 'tulare']",['tulare'],tulare,tulare,State Letter to Farmers Demands Water to Fix Nitrate Problem - Community Water Center,https://www.communitywatercenter.org/state_letter_to_farmers
192,"Tulare County Supervisor Allen Ishida, a citrus farmer from Lindsay, said the report failed to determine exactly where nitrates came from.",nitrates,"October 22, 2016","['davis', 'poplar', 'salinas', 'fresno', 'tulare']",['tulare'],tulare,tulare,State Letter to Farmers Demands Water to Fix Nitrate Problem - Community Water Center,https://www.communitywatercenter.org/state_letter_to_farmers
193,"“Harter was not asked to source the nitrates or age the water,” he said, pointing out that some water has been in the ground for eons and that nitrates can (come) from sources besides farms.",nitrates,"October 22, 2016","['davis', 'poplar', 'salinas', 'fresno', 'tulare']",['tulare'],tulare,tulare,State Letter to Farmers Demands Water to Fix Nitrate Problem - Community Water Center,https://www.communitywatercenter.org/state_letter_to_farmers
194,"Cristobal Chavez, 58, tested his well at his home near Poplar four months ago and found it was too high in nitrates to be safe to drink.",nitrates,"October 22, 2016","['davis', 'poplar', 'salinas', 'fresno', 'tulare']",['tulare'],tulare,tulare,State Letter to Farmers Demands Water to Fix Nitrate Problem - Community Water Center,https://www.communitywatercenter.org/state_letter_to_farmers
195," Residents of Arvin explained that although they live in a low-income community, they have had great difficulty accessing adequate funding to finance a water treatment facility, which means residents have been dealing with arsenic-contaminated water for over 10 years.",arsenic,"October 07, 2016","['fresno', 'arvin', 'porterville']",[],fresno,,AGUA and CWC Host Federal EPA Officials - Community Water Center,https://www.communitywatercenter.org/epa_officials
196," For instance, Seville residents had recently received a boil water notice that said to boil water to address bacterial contamination, but not to serve boiled water to infants because it might have high nitrate levels.",nitrate,"October 07, 2016","['fresno', 'arvin', 'porterville']",[],fresno,,AGUA and CWC Host Federal EPA Officials - Community Water Center,https://www.communitywatercenter.org/epa_officials
197," These confusing messages, which left older residents wondering why their health wasn’t of concern with nitrates, which can cause cancer through long-term consumption.",nitrate,"October 07, 2016","['fresno', 'arvin', 'porterville']",[],fresno,,AGUA and CWC Host Federal EPA Officials - Community Water Center,https://www.communitywatercenter.org/epa_officials
