,phrase,contaminant,date,city,county,main city,main county,title,page_url
337," Here’s how you can help – simply log into your Twitter account, copy, paste and send the following tweets today:@JerryBrownGov's #MayRevise falls short of addressing CA H20 crisis @MarkLeno support Asm’s #CAbudget drinking water proposal@JerryBrownGov's #MayRevise falls short of addressing CA H20 crisis @PhilTing support Asm’s #CAbudget drinking water proposal@JerryBrownGov's #MayRevise falls short of addressing CA H20 crisis Senator Nielson support Asm’s #CAbudget drinking water proposal@JerryBrownGov's #MayRevise falls short of addressing CA H20 crisis @JayObernolte support Asm’s #CAbudget drinking water proposalOur coalition will retweet your tweets and tag the Assembly members leading this budget proposal (@AsmEGarciaAD56, @AsmRichardBloom) so they know you support their proposal!We’ll continue this campaign right up until the June 15 deadline so stay tuned for more tweets! Thank you again for your support.",lead,"June 01, 2016",[],[],,,Action Alert - join our Twitter campaign #FundSafeH20 - Community Water Center,https://www.communitywatercenter.org/action_alert_twitter_campaign_fundsafeh20
338," As long as they’ve lived here, the water that comes out of their taps has been contaminated with arsenic and other chemicals; they refuse to drink it, and the very act of taking a shower can make them feel unclean.",arsenic,"May 27, 2016","['alpaugh', 'davis', 'porterville', 'fresno', 'tulare']",['tulare'],tulare,tulare,The Flint of California - Community Water Center,https://www.communitywatercenter.org/the_flint_of_california
339,"”The two most common hazards in this part of the Central Valley are arsenic, which occurs naturally, and nitrates from fertilizers spread over vast fields and from animal wastes that leach into the groundwater.",arsenic,"May 27, 2016","['alpaugh', 'davis', 'porterville', 'fresno', 'tulare']",['tulare'],tulare,tulare,The Flint of California - Community Water Center,https://www.communitywatercenter.org/the_flint_of_california
340,"The shame continued when residents from affected communities and their supporters assembled on the steps of the State Capitol in Sacramento bearing plastic bottles of contaminated water—nitrates from Tooleville, arsenic from Alpaugh—which they mixed into a “Central Valley blend” as a mock gift to legislators.",arsenic,"May 27, 2016","['alpaugh', 'davis', 'porterville', 'fresno', 'tulare']",['tulare'],tulare,tulare,The Flint of California - Community Water Center,https://www.communitywatercenter.org/the_flint_of_california
341,"”The two most common hazards in this part of the Central Valley are arsenic, which occurs naturally, and nitrates from fertilizers spread over vast fields and from animal wastes that leach into the groundwater.",nitrate,"May 27, 2016","['alpaugh', 'davis', 'porterville', 'fresno', 'tulare']",['tulare'],tulare,tulare,The Flint of California - Community Water Center,https://www.communitywatercenter.org/the_flint_of_california
342," Most of the nitrates lurking in drinking water wells today were applied to fields decades ago, so the contamination levels will likely get worse in coming years as the chemicals continue to filter into the groundwater, according to scientists at the University of California at Davis.",nitrate,"May 27, 2016","['alpaugh', 'davis', 'porterville', 'fresno', 'tulare']",['tulare'],tulare,tulare,The Flint of California - Community Water Center,https://www.communitywatercenter.org/the_flint_of_california
343,"The shame continued when residents from affected communities and their supporters assembled on the steps of the State Capitol in Sacramento bearing plastic bottles of contaminated water—nitrates from Tooleville, arsenic from Alpaugh—which they mixed into a “Central Valley blend” as a mock gift to legislators.",nitrate,"May 27, 2016","['alpaugh', 'davis', 'porterville', 'fresno', 'tulare']",['tulare'],tulare,tulare,The Flint of California - Community Water Center,https://www.communitywatercenter.org/the_flint_of_california
344,"”The two most common hazards in this part of the Central Valley are arsenic, which occurs naturally, and nitrates from fertilizers spread over vast fields and from animal wastes that leach into the groundwater.",nitrates,"May 27, 2016","['alpaugh', 'davis', 'porterville', 'fresno', 'tulare']",['tulare'],tulare,tulare,The Flint of California - Community Water Center,https://www.communitywatercenter.org/the_flint_of_california
345," Most of the nitrates lurking in drinking water wells today were applied to fields decades ago, so the contamination levels will likely get worse in coming years as the chemicals continue to filter into the groundwater, according to scientists at the University of California at Davis.",nitrates,"May 27, 2016","['alpaugh', 'davis', 'porterville', 'fresno', 'tulare']",['tulare'],tulare,tulare,The Flint of California - Community Water Center,https://www.communitywatercenter.org/the_flint_of_california
346,"The shame continued when residents from affected communities and their supporters assembled on the steps of the State Capitol in Sacramento bearing plastic bottles of contaminated water—nitrates from Tooleville, arsenic from Alpaugh—which they mixed into a “Central Valley blend” as a mock gift to legislators.",nitrates,"May 27, 2016","['alpaugh', 'davis', 'porterville', 'fresno', 'tulare']",['tulare'],tulare,tulare,The Flint of California - Community Water Center,https://www.communitywatercenter.org/the_flint_of_california
347,"“It tastes like watered-down bleach,” says Reinelda Palma, a longtime community leader whose house hosts the gatherings.",lead,"May 27, 2016","['alpaugh', 'davis', 'porterville', 'fresno', 'tulare']",['tulare'],tulare,tulare,The Flint of California - Community Water Center,https://www.communitywatercenter.org/the_flint_of_california
348,"”The Flint lead crisis has made us think of tainted water as an urban problem, aging pipes slowly poisoning the children of poor communities.",lead,"May 27, 2016","['alpaugh', 'davis', 'porterville', 'fresno', 'tulare']",['tulare'],tulare,tulare,The Flint of California - Community Water Center,https://www.communitywatercenter.org/the_flint_of_california
349," That is why we have been working with leadership in both houses on a proposal to increase funding for safe drinking water    ” said Laurel Firestone, co-executive director of the Community Water Center.",lead,"May 13, 2016",[],[],,,Governor’s Budget Falls Short of Addressing California’s Drinking Water Crisis - Community Water Center,https://www.communitywatercenter.org/mayrevise2016_pressrelease
350," RCAC has strong core services and expertise in housing, environmental infrastructure (water, wastewater and solid waste), leadership training, economic development and financing.",lead,"May 13, 2016",[],[],,,Governor’s Budget Falls Short of Addressing California’s Drinking Water Crisis - Community Water Center,https://www.communitywatercenter.org/mayrevise2016_pressrelease
351," We conducted community meetings, or ""platicas,"" in Arvin, East Porterville, and Fresno to talk with community partners about nitrate contamination, 1,2,3-TCP's impending Maximum Contaminant Level, and local water pilot projects.",nitrate,"May 09, 2016","['fresno', 'orosi', 'arvin', 'porterville']",[],orosi,,Great Accomplishments during National Drinking Water Week 2016!,https://www.communitywatercenter.org/accomplishments_ndww2016
352,"Community and nonprofit leaders say many of East Porterville's immigrants have been reluctant to sign up for government assistance, all but certain they will be deported.",lead,"May 07, 2016","['tulare', 'porterville']",['tulare'],porterville,tulare,"The wells have run dry in this California town, so why is a $1.2-million water system untapped? - Community Water Center",https://www.communitywatercenter.org/wellsrundry
353," After 15 years with arsenic contamination, one small Kern County community took the struggle for clean water into its own hands--in a campaign that could serve as a role model for others.",arsenic,"May 05, 2016","['arvin', 'lamont']",['kern'],arvin,kern,"“It looked really dirty” – Now, Arvin Kids Drink Clean Water In Schools - Community Water Center",https://www.communitywatercenter.org/it_looked_really_dirty
354,"”More precisely, it was contaminated—with arsenic.",arsenic,"May 05, 2016","['arvin', 'lamont']",['kern'],arvin,kern,"“It looked really dirty” – Now, Arvin Kids Drink Clean Water In Schools - Community Water Center",https://www.communitywatercenter.org/it_looked_really_dirty
355,"“Any of the medium sized and large cities, this isn't an issue because you can pay for the infrastructure to take the arsenic out of the water,” he says.",arsenic,"May 05, 2016","['arvin', 'lamont']",['kern'],arvin,kern,"“It looked really dirty” – Now, Arvin Kids Drink Clean Water In Schools - Community Water Center",https://www.communitywatercenter.org/it_looked_really_dirty
356," “But if you're in a small community, drilling new wells is hard, and many communities have drilled well upon well and the source water still contains arsenic.",arsenic,"May 05, 2016","['arvin', 'lamont']",['kern'],arvin,kern,"“It looked really dirty” – Now, Arvin Kids Drink Clean Water In Schools - Community Water Center",https://www.communitywatercenter.org/it_looked_really_dirty
357," Now, residents just need to wait a little longer for arsenic-free water in their homes.",arsenic,"May 05, 2016","['arvin', 'lamont']",['kern'],arvin,kern,"“It looked really dirty” – Now, Arvin Kids Drink Clean Water In Schools - Community Water Center",https://www.communitywatercenter.org/it_looked_really_dirty
358," The city is drilling new wells, and so far, arsenic levels are well within the safe zone.",arsenic,"May 05, 2016","['arvin', 'lamont']",['kern'],arvin,kern,"“It looked really dirty” – Now, Arvin Kids Drink Clean Water In Schools - Community Water Center",https://www.communitywatercenter.org/it_looked_really_dirty
359," “Bacterial and arsenic violations were the most common types of violations impacting schools, but they were also followed by the pesticide DBCP, disinfectant byproducts, and nitrates,”says lead author Jenny Rempel with the Community Water Center.",arsenic,"May 05, 2016","['tulare', 'arvin']",['tulare'],tulare,tulare,Unsafe Water in California Public Schools - Community Water Center,https://www.communitywatercenter.org/unsafe_water_in_california_public_schools
360,"com/admin/sites/1/pages/831/blog_post/editA sixth-grader at El Camino Real Elementary School in Arvin uses a water bottle filling station equipped with an industrial water filter, installed because Arvin’s public water is contaminated with arsenic.",arsenic,"May 05, 2016","['tulare', 'arvin']",['tulare'],tulare,tulare,Unsafe Water in California Public Schools - Community Water Center,https://www.communitywatercenter.org/unsafe_water_in_california_public_schools
361," Between 2003 and 2014, over 900 schools in the state may have provided water that was contaminated with arsenic or bacteria.",arsenic,"May 05, 2016","['tulare', 'arvin']",['tulare'],tulare,tulare,Unsafe Water in California Public Schools - Community Water Center,https://www.communitywatercenter.org/unsafe_water_in_california_public_schools
362,"""The most frequently occurring violations that we were seeing were bacterial and arsenic violations,"" said Remple.",arsenic,"May 05, 2016","['tulare', 'arvin']",['tulare'],tulare,tulare,Unsafe Water in California Public Schools - Community Water Center,https://www.communitywatercenter.org/unsafe_water_in_california_public_schools
363," “Bacterial and arsenic violations were the most common types of violations impacting schools, but they were also followed by the pesticide DBCP, disinfectant byproducts, and nitrates,”says lead author Jenny Rempel with the Community Water Center.",nitrate,"May 05, 2016","['tulare', 'arvin']",['tulare'],tulare,tulare,Unsafe Water in California Public Schools - Community Water Center,https://www.communitywatercenter.org/unsafe_water_in_california_public_schools
364," ""There were also pesticides, disinfectant by-products and nitrates.",nitrate,"May 05, 2016","['tulare', 'arvin']",['tulare'],tulare,tulare,Unsafe Water in California Public Schools - Community Water Center,https://www.communitywatercenter.org/unsafe_water_in_california_public_schools
365," “Bacterial and arsenic violations were the most common types of violations impacting schools, but they were also followed by the pesticide DBCP, disinfectant byproducts, and nitrates,”says lead author Jenny Rempel with the Community Water Center.",nitrates,"May 05, 2016","['tulare', 'arvin']",['tulare'],tulare,tulare,Unsafe Water in California Public Schools - Community Water Center,https://www.communitywatercenter.org/unsafe_water_in_california_public_schools
366," ""There were also pesticides, disinfectant by-products and nitrates.",nitrates,"May 05, 2016","['tulare', 'arvin']",['tulare'],tulare,tulare,Unsafe Water in California Public Schools - Community Water Center,https://www.communitywatercenter.org/unsafe_water_in_california_public_schools
367," “Bacterial and arsenic violations were the most common types of violations impacting schools, but they were also followed by the pesticide DBCP, disinfectant byproducts, and nitrates,”says lead author Jenny Rempel with the Community Water Center.",lead,"May 05, 2016","['tulare', 'arvin']",['tulare'],tulare,tulare,Unsafe Water in California Public Schools - Community Water Center,https://www.communitywatercenter.org/unsafe_water_in_california_public_schools
368,"Bacterial and arsenic violations were the most common types of violations impacting schools, followed by the pesticide DBCP, disinfectant byproducts, and nitrates.",arsenic,"May 05, 2016",['tulare'],['tulare'],tulare,tulare,Hundreds of California Schools Impacted by Unsafe Drinking Water - Community Water Center,https://www.communitywatercenter.org/hundreds_of_california_schools_impacted_by_unsafe_drinking_water
369,"Bacterial and arsenic violations were the most common types of violations impacting schools, followed by the pesticide DBCP, disinfectant byproducts, and nitrates.",nitrate,"May 05, 2016",['tulare'],['tulare'],tulare,tulare,Hundreds of California Schools Impacted by Unsafe Drinking Water - Community Water Center,https://www.communitywatercenter.org/hundreds_of_california_schools_impacted_by_unsafe_drinking_water
370,"Bacterial and arsenic violations were the most common types of violations impacting schools, followed by the pesticide DBCP, disinfectant byproducts, and nitrates.",nitrates,"May 05, 2016",['tulare'],['tulare'],tulare,tulare,Hundreds of California Schools Impacted by Unsafe Drinking Water - Community Water Center,https://www.communitywatercenter.org/hundreds_of_california_schools_impacted_by_unsafe_drinking_water
371,"“The problem could be even worse if the pipes and drinking fountains in schools leached lead or copper into the water supplies,” said Jenny Rempel, the lead contributor to the report and Communications Coordinator at the Community Water Center.",lead,"May 05, 2016",['tulare'],['tulare'],tulare,tulare,Hundreds of California Schools Impacted by Unsafe Drinking Water - Community Water Center,https://www.communitywatercenter.org/hundreds_of_california_schools_impacted_by_unsafe_drinking_water
372,Develop a statewide monitoring and reporting system specifically for lead and copper in schools.,lead,"May 05, 2016",['tulare'],['tulare'],tulare,tulare,Hundreds of California Schools Impacted by Unsafe Drinking Water - Community Water Center,https://www.communitywatercenter.org/hundreds_of_california_schools_impacted_by_unsafe_drinking_water
373, Excess levels — as much as three times the federal health limit — of nitrates less than 20 miles away in Monson.,nitrate,"May 05, 2016","['tulare', 'lamont']",['tulare'],tulare,tulare,"Unknown, Unregulated, Undrinkable - Community Water Center",https://www.communitywatercenter.org/unknown_unregulated_undrinkable
374, Excess levels — as much as three times the federal health limit — of nitrates less than 20 miles away in Monson.,nitrates,"May 05, 2016","['tulare', 'lamont']",['tulare'],tulare,tulare,"Unknown, Unregulated, Undrinkable - Community Water Center",https://www.communitywatercenter.org/unknown_unregulated_undrinkable
375, We need your help to make sure state leaders prioritize communities in need of safe water.,lead,"May 04, 2016",[],[],,,California's Drinking Water Crisis - Community Water Center,https://www.communitywatercenter.org/californias_drinking_water_crisis
376, I am also involved with an environmental leadership program in the UC Davis Arboretum where I work with other students to plan sustainable educational events for students and the greater community.,lead,"April 22, 2016",['davis'],[],davis,,Welcome CWC's New Interns! - Community Water Center,https://www.communitywatercenter.org/welcome_sacramento_new_interns
377,"Events include in-person community meetings about nitrate contamination, 1,2,3 - TCP contamination and how to get involved in water justice work in South Kern County.",nitrate,"April 13, 2016",['orosi'],['kern'],orosi,kern,National Drinking Water Week Calendar - Community Water Center,https://www.communitywatercenter.org/national_drinking_water_week_calendar
378," Arvin has violated federal drinking water standards for arsenic for over a decade, and according to the California Annual Compliance Report for Public Water Systems, over one million Californians are impacted by unsafe drinking water each year.",arsenic,"April 08, 2016","['arvin', 'lamont']",['kern'],arvin,kern,Agua4All Community Rally and Celebration a Success! - Community Water Center,https://www.communitywatercenter.org/agua4all_celebration
379, The event highlighted the progress the communities of Arvin and Lamont have made to improve access to safe drinking water in our schools and neighborhoods but also reminded local and state leaders that much more work remains to be done.,lead,"April 08, 2016","['arvin', 'lamont']",['kern'],arvin,kern,Agua4All Community Rally and Celebration a Success! - Community Water Center,https://www.communitywatercenter.org/agua4all_celebration
380,"Throughout California, groundwater nitrate contamination from agriculture is costing families, local governments and the state tens of millions of dollars a year.",nitrate,"March 31, 2016","['salinas', 'tulare', 'fresno']",['tulare'],salinas,tulare,State Takes Step to Better Regulate Agricultural Pollution of Groundwater,https://www.communitywatercenter.org/new_ag_order
381," As an acute contaminant, nitrate poses great health risks to communities, especially to pregnant women and young babies.",nitrate,"March 31, 2016","['salinas', 'tulare', 'fresno']",['tulare'],salinas,tulare,State Takes Step to Better Regulate Agricultural Pollution of Groundwater,https://www.communitywatercenter.org/new_ag_order
382, This order has the potential to set the state on track to reduce nitrate pollution from agriculture.,nitrate,"March 31, 2016","['salinas', 'tulare', 'fresno']",['tulare'],salinas,tulare,State Takes Step to Better Regulate Agricultural Pollution of Groundwater,https://www.communitywatercenter.org/new_ag_order
383," However, as currently designed, the ILRP does not provide the field-level data that is vital to measuring and regulating nitrate pollution from agriculture.",nitrate,"March 31, 2016","['salinas', 'tulare', 'fresno']",['tulare'],salinas,tulare,State Takes Step to Better Regulate Agricultural Pollution of Groundwater,https://www.communitywatercenter.org/new_ag_order
384," The new draft order allows the data that farmers are already reporting to be available to the public so that the state, researchers, and communities can understand the dynamics of nitrate use.",nitrate,"March 31, 2016","['salinas', 'tulare', 'fresno']",['tulare'],salinas,tulare,State Takes Step to Better Regulate Agricultural Pollution of Groundwater,https://www.communitywatercenter.org/new_ag_order
385," Unless we prevent ongoing contamination, by 2050, nearly 80 percent of the residents in the Tulare Lake Basin and Salinas Valley will be impacted by nitrate-contaminated drinking water.",nitrate,"March 31, 2016","['salinas', 'tulare', 'fresno']",['tulare'],salinas,tulare,State Takes Step to Better Regulate Agricultural Pollution of Groundwater,https://www.communitywatercenter.org/new_ag_order
386," And to ensure a livable future for residents of our state's agricultural regions, where hundreds if not thousands of wells have had to be closed due to nitrate pollution, creating an extra financial burden on our communities.",nitrate,"March 31, 2016","['salinas', 'tulare', 'fresno']",['tulare'],salinas,tulare,State Takes Step to Better Regulate Agricultural Pollution of Groundwater,https://www.communitywatercenter.org/new_ag_order
387,CWC and our allies across the state are analyzing the draft general order and have spoken before the California Department of Food and Agriculture about the need for adequate data and transparency to understand nitrate pollution and work toward solutions.,nitrate,"March 31, 2016","['salinas', 'tulare', 'fresno']",['tulare'],salinas,tulare,State Takes Step to Better Regulate Agricultural Pollution of Groundwater,https://www.communitywatercenter.org/new_ag_order
388," And many suffer as they did before the drought, enduring unsafe levels of nitrate and arsenic in their tap water.",arsenic,"February 25, 2016",['tulare'],['tulare'],tulare,tulare,"Laurel Firestone Among 20 Top Water Leaders to Contribute to New Book, Water: More or Less",https://www.communitywatercenter.org/new_book_water_more_or_less
389," And many suffer as they did before the drought, enduring unsafe levels of nitrate and arsenic in their tap water.",nitrate,"February 25, 2016",['tulare'],['tulare'],tulare,tulare,"Laurel Firestone Among 20 Top Water Leaders to Contribute to New Book, Water: More or Less",https://www.communitywatercenter.org/new_book_water_more_or_less
390,"CWC's Laurel Firestone is among twenty top water policy leaders who contributed personal essays to new book, Water: More or Less, by Water Education Foundation’s former executive director and long-time observer of the California water scene, Rita Schmidt Sudman.",lead,"February 25, 2016",['tulare'],['tulare'],tulare,tulare,"Laurel Firestone Among 20 Top Water Leaders to Contribute to New Book, Water: More or Less",https://www.communitywatercenter.org/new_book_water_more_or_less
391," She has seen first hand how contaminants such as nitrates and 123 TCP from agricultural and industrial practices affect the well-being of the workers and the residents of the small, rural communities throughout the Valley.",nitrate,"February 24, 2016","['fresno', 'poplar']",[],fresno,,Honoring the 2016 Water Justice Leaders!  - Community Water Center,https://www.communitywatercenter.org/honoring_2016_water_justice_leaders
392," She has seen first hand how contaminants such as nitrates and 123 TCP from agricultural and industrial practices affect the well-being of the workers and the residents of the small, rural communities throughout the Valley.",nitrates,"February 24, 2016","['fresno', 'poplar']",[],fresno,,Honoring the 2016 Water Justice Leaders!  - Community Water Center,https://www.communitywatercenter.org/honoring_2016_water_justice_leaders
393," Garibay leads Leadership Counsel's efforts in ensuring equitable land use planning and investment policies, access to basic services such as safe and affordable drinking water, and improved transportation opportunities.",lead,"February 24, 2016","['fresno', 'poplar']",[],fresno,,Honoring the 2016 Water Justice Leaders!  - Community Water Center,https://www.communitywatercenter.org/honoring_2016_water_justice_leaders
394, Veronica also leads the organization's regional and state climate justice advocacy efforts.,lead,"February 24, 2016","['fresno', 'poplar']",[],fresno,,Honoring the 2016 Water Justice Leaders!  - Community Water Center,https://www.communitywatercenter.org/honoring_2016_water_justice_leaders
395, She spoke of the well that her community has been forced to close due to nitrate contamination and of the fear that contaminated water will once again come from her faucet given Poplar's extreme vulnerability to nitrate contamination.,nitrate,"February 22, 2016",['poplar'],[],poplar,,State Water Board Adopts Human Right to Water Resolution! - Community Water Center,https://www.communitywatercenter.org/state_water_board_adopts_resolution
396,CWC is currently searching for a Policy Director to lead CWC’s policy advocacy programs and activities! Check out the job description on our Career Opportunities page! Like us to spread the wordTweet.,lead,"February 18, 2016",[],[],,,We're Hiring a Policy Director - Community Water Center,https://www.communitywatercenter.org/hiring_policy_director
397," In addition to his leadership as an integral member of the AGUA Coalition and a long-time United Farmworkers activist, Señor Quevedo also founded Vencinos Unidos, Neighbors United, which works in the communities of Orosi, East Orosi, and Cutler.",lead,"January 27, 2016","['fresno', 'tulare', 'orosi', 'salinas']",['tulare'],orosi,tulare,Water Justice Leadership Awards February 2015 - Community Water Center,https://www.communitywatercenter.org/wjla_february_2015
