,phrase,contaminant,date,city,county,main city,main county,title,page_url
526,"""School Superintendent Chris Kemper notes that because the water is contaminated with nitrates from fertilizer and septic systems, the children are not allowed to drink it.",nitrates,"August 08, 2014","['fresno', 'tulare']",['tulare'],tulare,tulare,New Water Well for Seville Residents - Community Water Center,https://www.communitywatercenter.org/new_well_for_seville
527,"""We have some issues with the quality of water, nitrates primarily but quantity is a big issue so people can flush their toilets, take baths and that sort of thing,"" said Worthley.",nitrates,"August 08, 2014","['fresno', 'tulare']",['tulare'],tulare,tulare,New Water Well for Seville Residents - Community Water Center,https://www.communitywatercenter.org/new_well_for_seville
528, The water district has an old nitrate-contaminated well and cracked pipes that allow sand to flow through residential taps.,nitrate,"August 08, 2014",['tulare'],['tulare'],tulare,tulare,Aging water system gets new well in Seville - Community Water Center,https://www.communitywatercenter.org/new_well_in_seville
529,"Even before the wells started going dry, Monson residents had to buy drinking water because of nitrate contamination that made made their well water unhealthy to drink.",nitrate,"August 07, 2014","['tulare', 'porterville']",['tulare'],tulare,tulare,Wells in Tulare County Are Going Dry - Community Water Center,https://www.communitywatercenter.org/wells_in_tulare_county_are_going_dry
530," Expect to hear more about bacteria and nitrate contamination, they tell me.",nitrate,"July 14, 2014","['fresno', 'tulare']",['tulare'],fresno,tulare,Rural San Joaquin Valley reeling from drought - Community Water Center,https://www.communitywatercenter.org/rural_san_joaquin_valley_reeling_from_drought
531," The community well is old, water pressure constantly drops and the water is known to have high levels of nitrates in it.",nitrate,"July 10, 2014",['tulare'],['tulare'],tulare,tulare,Tulare County trying to fix the water problem in Seville - Community Water Center,https://www.communitywatercenter.org/tulare_county_trying_to_fix_the_water_problem_in_seville
532," The community well is old, water pressure constantly drops and the water is known to have high levels of nitrates in it.",nitrates,"July 10, 2014",['tulare'],['tulare'],tulare,tulare,Tulare County trying to fix the water problem in Seville - Community Water Center,https://www.communitywatercenter.org/tulare_county_trying_to_fix_the_water_problem_in_seville
533,Supervisor Allen Ishida noted that Tulare County has the highest nitrate contamination rates for wells in the state.,nitrate,"July 09, 2014",['tulare'],['tulare'],tulare,tulare,"County seeking $500,000 to pay for emergency water - Community Water Center",https://www.communitywatercenter.org/county_seeking_five_hundred_thousand_to_pay_for_emergency_water
534,"In 2009, Tulare County assumed temporary receivership of the Seville Water Company, which was dealing with a failing system that included cracked pipes that allowed sand to flow through residential taps, nitrate contamination in the town’s well and a lack of money to fix the costly problems.",nitrate,"July 09, 2014",['tulare'],['tulare'],tulare,tulare,"County seeking $500,000 to pay for emergency water - Community Water Center",https://www.communitywatercenter.org/county_seeking_five_hundred_thousand_to_pay_for_emergency_water
535,"On May 30, the California Department of Public Health listed the Seville water system as experiencing a drought-related water emergency, and on June 28 a drinking water warning was issued to residents of the tiny, north-county town after tests showed nitrate levels the well exceeded maximum levels allowed by the state.",nitrate,"July 09, 2014",['tulare'],['tulare'],tulare,tulare,"County seeking $500,000 to pay for emergency water - Community Water Center",https://www.communitywatercenter.org/county_seeking_five_hundred_thousand_to_pay_for_emergency_water
536," The town's well now is pulling in nitrate-laced water, meaning the system is useless for drinking and cooking.",nitrate,"July 09, 2014","['fresno', 'tulare']",['tulare'],fresno,tulare,"Water crisis in Tulare County's Seville trigger state help, short-term fixes - Community Water Center",https://www.communitywatercenter.org/water_crisis_in_tulare_countys_seville_trigger_state_help_short_term_fixes
537," The organization urged state and federal leaders to move quickly on Seville's problems, but the town's system continues to limp along three years later.",lead,"July 09, 2014","['fresno', 'tulare']",['tulare'],fresno,tulare,"Water crisis in Tulare County's Seville trigger state help, short-term fixes - Community Water Center",https://www.communitywatercenter.org/water_crisis_in_tulare_countys_seville_trigger_state_help_short_term_fixes
538,County leaders stepped in to help the town in 2009 when Seville's private water-system owner went bankrupt.,lead,"July 09, 2014","['fresno', 'tulare']",['tulare'],fresno,tulare,"Water crisis in Tulare County's Seville trigger state help, short-term fixes - Community Water Center",https://www.communitywatercenter.org/water_crisis_in_tulare_countys_seville_trigger_state_help_short_term_fixes
539, County leaders are still working out details to allow only Seville residents to use the water.,lead,"July 09, 2014","['fresno', 'tulare']",['tulare'],fresno,tulare,"Water crisis in Tulare County's Seville trigger state help, short-term fixes - Community Water Center",https://www.communitywatercenter.org/water_crisis_in_tulare_countys_seville_trigger_state_help_short_term_fixes
540,"Data on logs also show at what depth wells are perforated to tap into groundwater – a detail that can help reveal how agricultural chemicals, such as nitrates and pesticides, flow from one part of an aquifer system to another.",nitrate,"July 06, 2014",['davis'],[],davis,,"The Public Eye: As drought persists, frustration mounts over secrecy of California's well drilling logs - Community Water Center",https://www.communitywatercenter.org/the_public_eye_as_drought_persists_frustration_mounts_over_secrecy_of_california_s_well_drilling_logs
541,"Data on logs also show at what depth wells are perforated to tap into groundwater – a detail that can help reveal how agricultural chemicals, such as nitrates and pesticides, flow from one part of an aquifer system to another.",nitrates,"July 06, 2014",['davis'],[],davis,,"The Public Eye: As drought persists, frustration mounts over secrecy of California's well drilling logs - Community Water Center",https://www.communitywatercenter.org/the_public_eye_as_drought_persists_frustration_mounts_over_secrecy_of_california_s_well_drilling_logs
542, Others worry that disclosing the locations of public supply wells could lead to an act of terrorism.,lead,"July 06, 2014",['davis'],[],davis,,"The Public Eye: As drought persists, frustration mounts over secrecy of California's well drilling logs - Community Water Center",https://www.communitywatercenter.org/the_public_eye_as_drought_persists_frustration_mounts_over_secrecy_of_california_s_well_drilling_logs
543," The problem of water contamination in the Central Valley has existed for decades, but the situation is exacerbated by the drought because less water means higher concentrations of nitrate and arsenic (among other contaminants).",arsenic,"June 15, 2014",['tulare'],['tulare'],tulare,tulare,Dried up: Poverty in America's drought lands - Community Water Center,https://www.communitywatercenter.org/dried_up_poverty_in_americas_drought_lands
544," The problem of water contamination in the Central Valley has existed for decades, but the situation is exacerbated by the drought because less water means higher concentrations of nitrate and arsenic (among other contaminants).",nitrate,"June 15, 2014",['tulare'],['tulare'],tulare,tulare,Dried up: Poverty in America's drought lands - Community Water Center,https://www.communitywatercenter.org/dried_up_poverty_in_americas_drought_lands
545," Those who do have water have to deal with pollution from nitrate, which is linked to blue baby syndrome, kidney disease and other maladies.",nitrate,"June 11, 2014",[],[],,,Opinion: Why I'm planning to kayak (and walk) America's 'most endangered' river - Community Water Center,https://www.communitywatercenter.org/opinion_why_im_planning_to_kayak_and_walk_americas_most_endangered_river
546, She and her husband use a $900 water filter/robot (it looks like a miniature version of Eve from WALL-E) to remove the nitrates from the water that comes out of their sink.,nitrate,"June 11, 2014",[],[],,,Opinion: Why I'm planning to kayak (and walk) America's 'most endangered' river - Community Water Center,https://www.communitywatercenter.org/opinion_why_im_planning_to_kayak_and_walk_americas_most_endangered_river
547, She and her husband use a $900 water filter/robot (it looks like a miniature version of Eve from WALL-E) to remove the nitrates from the water that comes out of their sink.,nitrates,"June 11, 2014",[],[],,,Opinion: Why I'm planning to kayak (and walk) America's 'most endangered' river - Community Water Center,https://www.communitywatercenter.org/opinion_why_im_planning_to_kayak_and_walk_americas_most_endangered_river
548,Tulare County leaders said they are in drought triage.,lead,"May 05, 2014","['fresno', 'tulare', 'porterville']",['tulare'],tulare,tulare,Tulare County couple face summer without water as well runs dry - Community Water Center,https://www.communitywatercenter.org/tulare_county_couple_face_summer_without_water_as_well_runs_dry
549," In counties where the drought hits hardest, leaders also are focused on trying to find help for entire communities, in addition to working with private well owners.",lead,"May 05, 2014","['fresno', 'tulare', 'porterville']",['tulare'],tulare,tulare,Tulare County couple face summer without water as well runs dry - Community Water Center,https://www.communitywatercenter.org/tulare_county_couple_face_summer_without_water_as_well_runs_dry
550,"""State leaders also are trying to find solutions for private well owners by helping to fund extensions to public drinking water systems, though that option may not work for the Almanzas.",lead,"May 05, 2014","['fresno', 'tulare', 'porterville']",['tulare'],tulare,tulare,Tulare County couple face summer without water as well runs dry - Community Water Center,https://www.communitywatercenter.org/tulare_county_couple_face_summer_without_water_as_well_runs_dry
551," Boiling water may kill things like bacteria and pathogens, but often concentrates other contaminants like nitrate or arsenic, making those problems worse.",arsenic,"May 04, 2014",[],[],,,What's in Your Water? - Community Water Center,https://www.communitywatercenter.org/whats_in_your_water
552," Boiling water may kill things like bacteria and pathogens, but often concentrates other contaminants like nitrate or arsenic, making those problems worse.",nitrate,"May 04, 2014",[],[],,,What's in Your Water? - Community Water Center,https://www.communitywatercenter.org/whats_in_your_water
553," There are many ways for you to get involved:Sign our PetitionIn honor of National Drinking Water Week, we ask you to stand with impacted communities, advocates, and allies by signing a petition to policy makers and elected leaders, demanding that the State California take proactive steps to implement the Human Right to Water bill (AB 685).",lead,"May 04, 2014",[],[],,,What's in Your Water? - Community Water Center,https://www.communitywatercenter.org/whats_in_your_water
554,"As the political trio announced its plan in Sacramento on Wednesday, Republican leaders fired back saying the legislation is lacking long-term solutions.",lead,"February 19, 2014","['fresno', 'tulare']",['tulare'],fresno,tulare,Gov. Jerry Brown's drought plan to help Valley towns - Community Water Center,https://www.communitywatercenter.org/gov_jerry_brown_s_drought_plan_to_help_valley_towns
555,"”Coal ash contains arsenic, mercury, lead, thallium, and other dangerous contaminants.",arsenic,"February 17, 2014","['davis', 'tulare', 'salinas', 'jackson']",['tulare'],jackson,tulare,Water in America: Is It Safe to Drink? - Community Water Center,https://www.communitywatercenter.org/water_in_america_is_it_safe_to_drink
556,"In a 2012 report prepared for the California State Water Control Board, scientists from the University of California at Davis found that about 254,000 people in the Tulare Lake Basin and Salinas Valley are currently at risk for nitrate contamination of their drinking water.",nitrate,"February 17, 2014","['davis', 'tulare', 'salinas', 'jackson']",['tulare'],jackson,tulare,Water in America: Is It Safe to Drink? - Community Water Center,https://www.communitywatercenter.org/water_in_america_is_it_safe_to_drink
557," In one of the nation’s most productive farming regions, nitrates from heavily fertilized fields leach into the groundwater.",nitrate,"February 17, 2014","['davis', 'tulare', 'salinas', 'jackson']",['tulare'],jackson,tulare,Water in America: Is It Safe to Drink? - Community Water Center,https://www.communitywatercenter.org/water_in_america_is_it_safe_to_drink
558,"As a result of the current drought, farmers are having to rely on groundwater to irrigate their fields—which inevitably raises the concentration of nitrates in the water left in the ground.",nitrate,"February 17, 2014","['davis', 'tulare', 'salinas', 'jackson']",['tulare'],jackson,tulare,Water in America: Is It Safe to Drink? - Community Water Center,https://www.communitywatercenter.org/water_in_america_is_it_safe_to_drink
559,"” Exposures to high levels of nitrates can cause death, miscarriages, and blue baby syndrome, she said.",nitrate,"February 17, 2014","['davis', 'tulare', 'salinas', 'jackson']",['tulare'],jackson,tulare,Water in America: Is It Safe to Drink? - Community Water Center,https://www.communitywatercenter.org/water_in_america_is_it_safe_to_drink
560," In one of the nation’s most productive farming regions, nitrates from heavily fertilized fields leach into the groundwater.",nitrates,"February 17, 2014","['davis', 'tulare', 'salinas', 'jackson']",['tulare'],jackson,tulare,Water in America: Is It Safe to Drink? - Community Water Center,https://www.communitywatercenter.org/water_in_america_is_it_safe_to_drink
561,"As a result of the current drought, farmers are having to rely on groundwater to irrigate their fields—which inevitably raises the concentration of nitrates in the water left in the ground.",nitrates,"February 17, 2014","['davis', 'tulare', 'salinas', 'jackson']",['tulare'],jackson,tulare,Water in America: Is It Safe to Drink? - Community Water Center,https://www.communitywatercenter.org/water_in_america_is_it_safe_to_drink
562,"” Exposures to high levels of nitrates can cause death, miscarriages, and blue baby syndrome, she said.",nitrates,"February 17, 2014","['davis', 'tulare', 'salinas', 'jackson']",['tulare'],jackson,tulare,Water in America: Is It Safe to Drink? - Community Water Center,https://www.communitywatercenter.org/water_in_america_is_it_safe_to_drink
563,"”Coal ash contains arsenic, mercury, lead, thallium, and other dangerous contaminants.",lead,"February 17, 2014","['davis', 'tulare', 'salinas', 'jackson']",['tulare'],jackson,tulare,Water in America: Is It Safe to Drink? - Community Water Center,https://www.communitywatercenter.org/water_in_america_is_it_safe_to_drink
564," Tests of nearby river water showed levels of lead and thallium exceeded safety limits for drinking water, but the TVA said at the time that the toxic metals were filtered out by water treatment processes.",lead,"February 17, 2014","['davis', 'tulare', 'salinas', 'jackson']",['tulare'],jackson,tulare,Water in America: Is It Safe to Drink? - Community Water Center,https://www.communitywatercenter.org/water_in_america_is_it_safe_to_drink
565," In adults, long-term exposure to nitrates can lead to the formation of carcinogenic compounds called nitrosamines, believed to contribute to elevate the likelihood of various forms of cancer.",carcinogenic,"February 13, 2014","['fresno', 'salinas', 'tulare', 'davis']",['tulare'],fresno,tulare,California's Lingering Drought and Pollution Defy Solutions - Community Water Center,https://www.communitywatercenter.org/california_s_lingering_drought_and_pollution_defy_solutions
566," A February report from the State Water Resources Control Board identified 31 principal contaminants, including arsenic, uranium, perchlorate and pesticide residues in groundwater serving 21 million Californians.",arsenic,"February 13, 2014","['fresno', 'salinas', 'tulare', 'davis']",['tulare'],fresno,tulare,California's Lingering Drought and Pollution Defy Solutions - Community Water Center,https://www.communitywatercenter.org/california_s_lingering_drought_and_pollution_defy_solutions
567,Kettleman’s groundwater is contaminated with arsenic at an average of 12.,arsenic,"February 13, 2014","['fresno', 'salinas', 'tulare', 'davis']",['tulare'],fresno,tulare,California's Lingering Drought and Pollution Defy Solutions - Community Water Center,https://www.communitywatercenter.org/california_s_lingering_drought_and_pollution_defy_solutions
568, Yet an information sheet on arsenic from the California Office of Environmental Health Hazard Assessment suggests that long-term ingestion of arsenic at levels below the legal limit have been shown to increase risk of certain kinds of cancer.,arsenic,"February 13, 2014","['fresno', 'salinas', 'tulare', 'davis']",['tulare'],fresno,tulare,California's Lingering Drought and Pollution Defy Solutions - Community Water Center,https://www.communitywatercenter.org/california_s_lingering_drought_and_pollution_defy_solutions
569,"• Further south, the state’s Central Valley has become a great dumping ground for industrial and agricultural toxins – pesticides, fertilizers and other forms of industrial waste contaminate municipal and private wells with nitrates.",nitrate,"February 13, 2014","['fresno', 'salinas', 'tulare', 'davis']",['tulare'],fresno,tulare,California's Lingering Drought and Pollution Defy Solutions - Community Water Center,https://www.communitywatercenter.org/california_s_lingering_drought_and_pollution_defy_solutions
570,"The water systems tap into aquifers contaminated with nitrates, a constituent of of synthetic fertilizer and manure, and other agricultural contaminants.",nitrate,"February 13, 2014","['fresno', 'salinas', 'tulare', 'davis']",['tulare'],fresno,tulare,California's Lingering Drought and Pollution Defy Solutions - Community Water Center,https://www.communitywatercenter.org/california_s_lingering_drought_and_pollution_defy_solutions
571," A 2012 report from the University of California at Davis found that 254,000 people in the Salinas Valley and Tulare Basin, two major agricultural regions, are at risk of nitrate contamination.",nitrate,"February 13, 2014","['fresno', 'salinas', 'tulare', 'davis']",['tulare'],fresno,tulare,California's Lingering Drought and Pollution Defy Solutions - Community Water Center,https://www.communitywatercenter.org/california_s_lingering_drought_and_pollution_defy_solutions
572," Of the nitrates seeping into the Central Valley’s groundwater, a full 96 percent comes from the region’s croplands, the report found.",nitrate,"February 13, 2014","['fresno', 'salinas', 'tulare', 'davis']",['tulare'],fresno,tulare,California's Lingering Drought and Pollution Defy Solutions - Community Water Center,https://www.communitywatercenter.org/california_s_lingering_drought_and_pollution_defy_solutions
573,"According to Peter Weyer, associate director of the University of Iowa’s Center for Health Effects of Environmental Contamination, nitrates are often seen as an indicator of “overall” water quality – and high levels can indicate the presence of other microbial or organic contaminants.",nitrate,"February 13, 2014","['fresno', 'salinas', 'tulare', 'davis']",['tulare'],fresno,tulare,California's Lingering Drought and Pollution Defy Solutions - Community Water Center,https://www.communitywatercenter.org/california_s_lingering_drought_and_pollution_defy_solutions
574," “The problems can go way beyond nitrate in places where there is inadequate filtration,” Weyer says.",nitrate,"February 13, 2014","['fresno', 'salinas', 'tulare', 'davis']",['tulare'],fresno,tulare,California's Lingering Drought and Pollution Defy Solutions - Community Water Center,https://www.communitywatercenter.org/california_s_lingering_drought_and_pollution_defy_solutions
575," In adults, long-term exposure to nitrates can lead to the formation of carcinogenic compounds called nitrosamines, believed to contribute to elevate the likelihood of various forms of cancer.",nitrate,"February 13, 2014","['fresno', 'salinas', 'tulare', 'davis']",['tulare'],fresno,tulare,California's Lingering Drought and Pollution Defy Solutions - Community Water Center,https://www.communitywatercenter.org/california_s_lingering_drought_and_pollution_defy_solutions
576, But if you boil the water you concentrate the nitrates.,nitrate,"February 13, 2014","['fresno', 'salinas', 'tulare', 'davis']",['tulare'],fresno,tulare,California's Lingering Drought and Pollution Defy Solutions - Community Water Center,https://www.communitywatercenter.org/california_s_lingering_drought_and_pollution_defy_solutions
577,"• Further south, the state’s Central Valley has become a great dumping ground for industrial and agricultural toxins – pesticides, fertilizers and other forms of industrial waste contaminate municipal and private wells with nitrates.",nitrates,"February 13, 2014","['fresno', 'salinas', 'tulare', 'davis']",['tulare'],fresno,tulare,California's Lingering Drought and Pollution Defy Solutions - Community Water Center,https://www.communitywatercenter.org/california_s_lingering_drought_and_pollution_defy_solutions
578,"The water systems tap into aquifers contaminated with nitrates, a constituent of of synthetic fertilizer and manure, and other agricultural contaminants.",nitrates,"February 13, 2014","['fresno', 'salinas', 'tulare', 'davis']",['tulare'],fresno,tulare,California's Lingering Drought and Pollution Defy Solutions - Community Water Center,https://www.communitywatercenter.org/california_s_lingering_drought_and_pollution_defy_solutions
579," Of the nitrates seeping into the Central Valley’s groundwater, a full 96 percent comes from the region’s croplands, the report found.",nitrates,"February 13, 2014","['fresno', 'salinas', 'tulare', 'davis']",['tulare'],fresno,tulare,California's Lingering Drought and Pollution Defy Solutions - Community Water Center,https://www.communitywatercenter.org/california_s_lingering_drought_and_pollution_defy_solutions
580,"According to Peter Weyer, associate director of the University of Iowa’s Center for Health Effects of Environmental Contamination, nitrates are often seen as an indicator of “overall” water quality – and high levels can indicate the presence of other microbial or organic contaminants.",nitrates,"February 13, 2014","['fresno', 'salinas', 'tulare', 'davis']",['tulare'],fresno,tulare,California's Lingering Drought and Pollution Defy Solutions - Community Water Center,https://www.communitywatercenter.org/california_s_lingering_drought_and_pollution_defy_solutions
581," In adults, long-term exposure to nitrates can lead to the formation of carcinogenic compounds called nitrosamines, believed to contribute to elevate the likelihood of various forms of cancer.",nitrates,"February 13, 2014","['fresno', 'salinas', 'tulare', 'davis']",['tulare'],fresno,tulare,California's Lingering Drought and Pollution Defy Solutions - Community Water Center,https://www.communitywatercenter.org/california_s_lingering_drought_and_pollution_defy_solutions
582, But if you boil the water you concentrate the nitrates.,nitrates,"February 13, 2014","['fresno', 'salinas', 'tulare', 'davis']",['tulare'],fresno,tulare,California's Lingering Drought and Pollution Defy Solutions - Community Water Center,https://www.communitywatercenter.org/california_s_lingering_drought_and_pollution_defy_solutions
583,Less snowmelt from Sierra Nevada leads to more pumping of Central Valley’s contaminated groundwater.,lead,"February 13, 2014","['fresno', 'salinas', 'tulare', 'davis']",['tulare'],fresno,tulare,California's Lingering Drought and Pollution Defy Solutions - Community Water Center,https://www.communitywatercenter.org/california_s_lingering_drought_and_pollution_defy_solutions
584," That, in turn, could lead to a 17 percent increase in groundwater pumping from the Central Valley.",lead,"February 13, 2014","['fresno', 'salinas', 'tulare', 'davis']",['tulare'],fresno,tulare,California's Lingering Drought and Pollution Defy Solutions - Community Water Center,https://www.communitywatercenter.org/california_s_lingering_drought_and_pollution_defy_solutions
585," In adults, long-term exposure to nitrates can lead to the formation of carcinogenic compounds called nitrosamines, believed to contribute to elevate the likelihood of various forms of cancer.",lead,"February 13, 2014","['fresno', 'salinas', 'tulare', 'davis']",['tulare'],fresno,tulare,California's Lingering Drought and Pollution Defy Solutions - Community Water Center,https://www.communitywatercenter.org/california_s_lingering_drought_and_pollution_defy_solutions
